{
  "schemaVersion": 1,
  "id": "generic-motorcycle",
  "manufacturer": "Generic",
  "model": "Motorcycle",
  "generation": null,
  "yearFrom": null,
  "yearTo": null,
  "engineName": null,
  "engineDisplacementCc": null,
  "maximumTorqueNm": null,
  "nominalPowerKw": null,
  "gearboxGears": null,
  "fuelCapacityLiters": null,
  "fuelReserveLiters": null,
  "iceWarningTemperatureCelsius": null,
  "idleRpm": null,
  "idleToleranceRpm": null,
  "torquePeakRpm": null,
  "powerPeakRpm": null,
  "tachometerScaleMinRpm": 0,
  "tachometerScaleMaxRpm": null,
  "warningStartRpm": null,
  "redZoneStartRpm": null,
  "revLimiterRpm": null,
  "source": "SVC generic motorcycle fallback; no performance assumptions",
  "reference": "docs/reference-vehicle/bmw-k25-2007/dashboard-profile.md",
  "confidence": "unknown"
}
