{
  "schemaVersion": 1,
  "id": "bmw-r1200gs-k25-2007",
  "manufacturer": "BMW",
  "model": "R1200GS",
  "generation": "K25",
  "yearFrom": 2007,
  "yearTo": 2007,
  "engineName": "1170 cc two-cylinder boxer",
  "engineDisplacementCc": 1170,
  "maximumTorqueNm": 115,
  "nominalPowerKw": 74,
  "gearboxGears": 6,
  "fuelCapacityLiters": 20,
  "fuelReserveLiters": 4,
  "iceWarningTemperatureCelsius": 3,
  "idleRpm": 1150,
  "idleToleranceRpm": 50,
  "torquePeakRpm": 5500,
  "powerPeakRpm": 7000,
  "tachometerScaleMinRpm": 0,
  "tachometerScaleMaxRpm": 9000,
  "warningStartRpm": 7000,
  "redZoneStartRpm": 7800,
  "revLimiterRpm": null,
  "source": "SVC Reference Vehicle #001 profile approved by the Product Owner",
  "reference": "docs/reference-vehicle/bmw-k25-2007/dashboard-profile.md",
  "confidence": "product-owner-approved"
}
